<?xml version="1.0" encoding="UTF-8"?>
<curriculos xmlns="http://www.example.com/curriculo" xmlns:xsi="http://www.w3.org/2001/XMLSchema-instance" xsi:schemaLocation="curriculo curriculo.xsd">
	<disciplinasDisponiveis>
		<curso id="97001">
			<nome>Engenharia de Computação</nome>
			<periodo id="1">
				<disciplina id="FCM0101">
					<nome>Física I</nome>
					<categoria>obrigatória</categoria>
					<creditos>
						<aula>6</aula>
						<trabalho>0</trabalho>
					</creditos>
				</disciplina>
				<disciplina id="FFI0180">
					<nome>Laboratório de Física Geral I</nome>
					<categoria>obrigatória</categoria>
					<creditos>
						<aula>2</aula>
						<trabalho>0</trabalho>
					</creditos>
				</disciplina>
				<disciplina id="IAU0126">
					<nome>Humanidades e Ciências Sociais</nome>
					<categoria>obrigatória</categoria>
					<creditos>
						<aula>2</aula>
						<trabalho>0</trabalho>
					</creditos>
				</disciplina>
				<disciplina id="SEL0600">
					<nome>Informação Profissional em Engenharia de Computação I</nome>
					<categoria>obrigatória</categoria>
					<creditos>
						<aula>1</aula>
						<trabalho>0</trabalho>
					</creditos>
				</disciplina>
				<disciplina id="SMA0300">
					<nome>Geometria Analítica</nome>
					<categoria>obrigatória</categoria>
					<creditos>
						<aula>4</aula>
						<trabalho>0</trabalho>
					</creditos>
				</disciplina>
				<disciplina id="SMA0301">
					<nome>Cálculo I</nome>
					<categoria>obrigatória</categoria>
					<creditos>
						<aula>6</aula>
						<trabalho>0</trabalho>
					</creditos>
				</disciplina>
				<disciplina id="SSC0600">
					<nome>Introdução à Ciência da Computação I</nome>
					<categoria>obrigatória</categoria>
					<creditos>
						<aula>4</aula>
						<trabalho>0</trabalho>
					</creditos>
				</disciplina>
				<disciplina id="SSC0601">
					<nome>Laboratório de Introdução à Ciência da Computação I</nome>
					<categoria>obrigatória</categoria>
					<creditos>
						<aula>2</aula>
						<trabalho>2</trabalho>
					</creditos>
				</disciplina>
				<disciplina id="SSC0671">
					<nome>Informação Profissional em Engenharia da Computação II</nome>
					<categoria>obrigatória</categoria>
					<creditos>
						<aula>1</aula>
						<trabalho>0</trabalho>
					</creditos>
				</disciplina>
				<disciplina id="SSC0530">
					<nome>Introdução à Sistemas de Informação</nome>
					<categoria>eletiva</categoria>
					<creditos>
						<aula>2</aula>
						<trabalho>0</trabalho>
					</creditos>
				</disciplina>
			</periodo>
		</curso>
	</disciplinasDisponiveis>
	<aluno id="7526989">
		<nome>Davi Diório Mendes</nome>
		<semestre id="1">
			<disciplina ref="FCM0101" status="aprovado">
				<frequencia>100</frequencia>
				<nota>5.9</nota>
			</disciplina>
			<disciplina ref="FFI0180" status="aprovado">
				<frequencia>100</frequencia>
				<nota>9.0</nota>
			</disciplina>
			<disciplina ref="IAU0126" status="aprovado">
				<frequencia>100</frequencia>
				<nota>9.0</nota>
			</disciplina>
			<disciplina ref="SEL0600" status="aprovado">
				<frequencia>93</frequencia>
				<nota>10.0</nota>
			</disciplina>
			<disciplina ref="SMA0300" status="aprovado">
				<frequencia>100</frequencia>
				<nota>8.5</nota>
			</disciplina>
			<disciplina ref="SMA0301" status="aprovado">
				<frequencia>100</frequencia>
				<nota>6.1</nota>
			</disciplina>
			<disciplina ref="SSC0600" status="aprovado">
				<frequencia>100</frequencia>
				<nota>9.4</nota>
			</disciplina>
			<disciplina ref="SSC0601" status="aprovado">
				<frequencia>88</frequencia>
				<nota>9.8</nota>
			</disciplina>
			<disciplina ref="SSC0671" status="aprovado">
				<frequencia>100</frequencia>
				<nota>7.4</nota>
			</disciplina>
		</semestre>
	</aluno>
</curriculos>