<?xml version="1.0" encoding="ISO-8859-1"?>
<c:curriculos xmlns:c="http://www.example.com/curriculo" xmlns:xsi="http://www.w3.org/2001/XMLSchema-instance" xsi:schemaLocation="curriculo curriculo.xsd">
	<c:disciplinasDisponiveis>
		<c:curso id="97001">
			<c:nome>Engenharia de Computação</c:nome>
			<c:periodo id="1">
				<c:disciplina id="FCM0101">
					<c:nome>Física I</c:nome>
					<c:categoria>obrigatória</c:categoria>
					<c:creditos>
						<c:aula>6</c:aula>
						<c:trabalho>0</c:trabalho>
					</c:creditos>
				</c:disciplina>
				<c:disciplina id="FFI0180">
					<c:nome>Laboratório de Física Geral I</c:nome>
					<c:categoria>obrigatória</c:categoria>
					<c:creditos>
						<c:aula>2</c:aula>
						<c:trabalho>0</c:trabalho>
					</c:creditos>
				</c:disciplina>
				<c:disciplina id="IAU0126">
					<c:nome>Humanidades e Ciências Sociais</c:nome>
					<c:categoria>obrigatória</c:categoria>
					<c:creditos>
						<c:aula>2</c:aula>
						<c:trabalho>0</c:trabalho>
					</c:creditos>
				</c:disciplina>
				<c:disciplina id="SEL0600">
					<c:nome>Informação Profissional em Engenharia de Computação I</c:nome>
					<c:categoria>obrigatória</c:categoria>
					<c:creditos>
						<c:aula>1</c:aula>
						<c:trabalho>0</c:trabalho>
					</c:creditos>
				</c:disciplina>
				<c:disciplina id="SMA0300">
					<c:nome>Geometria Analítica</c:nome>
					<c:categoria>obrigatória</c:categoria>
					<c:creditos>
						<c:aula>4</c:aula>
						<c:trabalho>0</c:trabalho>
					</c:creditos>
				</c:disciplina>
				<c:disciplina id="SMA0301">
					<c:nome>Cálculo I</c:nome>
					<c:categoria>obrigatória</c:categoria>
					<c:creditos>
						<c:aula>6</c:aula>
						<c:trabalho>0</c:trabalho>
					</c:creditos>
				</c:disciplina>
				<c:disciplina id="SSC0600">
					<c:nome>Introdução à Ciência da Computação I</c:nome>
					<c:categoria>obrigatória</c:categoria>
					<c:creditos>
						<c:aula>4</c:aula>
						<c:trabalho>0</c:trabalho>
					</c:creditos>
				</c:disciplina>
				<c:disciplina id="SSC0601">
					<c:nome>Laboratório de Introdução à Ciência da Computação I</c:nome>
					<c:categoria>obrigatória</c:categoria>
					<c:creditos>
						<c:aula>2</c:aula>
						<c:trabalho>2</c:trabalho>
					</c:creditos>
				</c:disciplina>
				<c:disciplina id="SSC0671">
					<c:nome>Informação Profissional em Engenharia da Computação II</c:nome>
					<c:categoria>obrigatória</c:categoria>
					<c:creditos>
						<c:aula>1</c:aula>
						<c:trabalho>0</c:trabalho>
					</c:creditos>
				</c:disciplina>
				<c:disciplina id="SSC0530">
					<c:nome>Introdução à Sistemas de Informação</c:nome>
					<c:categoria>eletiva</c:categoria>
					<c:creditos>
						<c:aula>2</c:aula>
						<c:trabalho>0</c:trabalho>
					</c:creditos>
				</c:disciplina>
			</c:periodo>
			<c:periodo id="2">
				<c:disciplina id="FCM0102">
					<c:nome>Física II</c:nome>
					<c:categoria>eletiva</c:categoria>
					<c:creditos>
						<c:aula>6</c:aula>
						<c:trabalho>0</c:trabalho>
					</c:creditos>
				</c:disciplina>
			</c:periodo>
		</c:curso>
	</c:disciplinasDisponiveis>
	<c:aluno id="7526989">
		<c:nome>Davi Diório Mendes</c:nome>
		<c:semestre id="1">
			<c:disciplina ref="FCM0101" status="aprovado">
				<c:frequencia>100</c:frequencia>
				<c:nota>5.9</c:nota>
			</c:disciplina>
			<c:disciplina ref="FFI0180" status="aprovado">
				<c:frequencia>100</c:frequencia>
				<c:nota>9.0</c:nota>
			</c:disciplina>
			<c:disciplina ref="IAU0126" status="aprovado">
				<c:frequencia>100</c:frequencia>
				<c:nota>9.0</c:nota>
			</c:disciplina>
			<c:disciplina ref="SEL0600" status="aprovado">
				<c:frequencia>93</c:frequencia>
				<c:nota>10.0</c:nota>
			</c:disciplina>
			<c:disciplina ref="SMA0300" status="aprovado">
				<c:frequencia>100</c:frequencia>
				<c:nota>8.5</c:nota>
			</c:disciplina>
			<c:disciplina ref="SMA0301" status="aprovado">
				<c:frequencia>100</c:frequencia>
				<c:nota>6.1</c:nota>
			</c:disciplina>
			<c:disciplina ref="SSC0600" status="aprovado">
				<c:frequencia>100</c:frequencia>
				<c:nota>9.4</c:nota>
			</c:disciplina>
			<c:disciplina ref="SSC0601" status="aprovado">
				<c:frequencia>88</c:frequencia>
				<c:nota>9.8</c:nota>
			</c:disciplina>
			<c:disciplina ref="SSC0671" status="aprovado">
				<c:frequencia>100</c:frequencia>
				<c:nota>7.4</c:nota>
			</c:disciplina>
		</c:semestre>
	</c:aluno>
	<aluno id="7017647">
		<nome>João da Silva</nome>
	</aluno>
	<aluno id="7674521">
		<nome>Juca Mun Dongo</nome>
	</aluno>
	<aluno id="686875">
		<nome>Elise Gobbo</nome>
	</aluno>
</c:curriculos>